{
  "$schema": "http://json-schema.org/draft-07/schema#",
  "$id": "https://studywan.local/schemas/cards.schema.json",
  "title": "StudyWan Card",
  "type": "object",
  "additionalProperties": false,
  "required": ["id", "trad", "pinyin", "band", "level"],
  "properties": {
    "id": { "type": "string", "minLength": 1 },
    "trad": { "type": "string", "minLength": 1 },
    "simp": { "type": "string" },
    "pinyin": { "type": "string", "minLength": 1 },
    "zhuyin": { "type": "string" },
    "pos": { "type": "string" },
    "gloss_en": { "type": "string", "minLength": 1 },
    "gloss_de": { "type": "string" },
    "band": { "type": "string", "enum": ["A", "B", "C"] },
    "level": { "type": "integer", "minimum": 0, "maximum": 6 },
    "topic": { "type": "string" },
    "tags": { "type": "array", "items": { "type": "string" } },
    "source": {
      "type": "object",
      "additionalProperties": false,
      "properties": {
        "name": { "type": "string" },
        "url": { "type": "string" }
      }
    },
    "audio": {
      "type": "object",
      "additionalProperties": false,
      "properties": {
        "url": { "type": "string" },
        "voice": { "type": "string" },
        "license": { "type": "string" }
      }
    }
  }
}
