[
  {
    "id": "A1-0251",
    "trad": "病人",
    "pinyin": "bìngrén",
    "pos": "N",
    "gloss_en": "",
    "band": "A",
    "level": 1,
    "topic": "健康及身體照護",
    "tags": []
  },
  {
    "id": "A1-0252",
    "trad": "頭髮/髮",
    "pinyin": "tóufă/fă",
    "pos": "N",
    "gloss_en": "",
    "band": "A",
    "level": 1,
    "topic": "健康及身體照護",
    "tags": []
  },
  {
    "id": "A1-0253",
    "trad": "手指(頭)/指頭",
    "pinyin": "shŏuzhĭ(tou)/zhĭtou",
    "pos": "N",
    "gloss_en": "",
    "band": "A",
    "level": 1,
    "topic": "健康及身體照護",
    "tags": []
  },
  {
    "id": "A1-0254",
    "trad": "肚(子)",
    "pinyin": "dù(zi)",
    "pos": "N",
    "gloss_en": "",
    "band": "A",
    "level": 1,
    "topic": "健康及身體照護",
    "tags": []
  },
  {
    "id": "A1-0255",
    "trad": "臉",
    "pinyin": "liăn",
    "pos": "N",
    "gloss_en": "",
    "band": "A",
    "level": 1,
    "topic": "健康及身體照護",
    "tags": []
  },
  {
    "id": "A1-0256",
    "trad": "心",
    "pinyin": "xīn",
    "pos": "N",
    "gloss_en": "",
    "band": "A",
    "level": 1,
    "topic": "健康及身體照護",
    "tags": []
  },
  {
    "id": "A1-0257",
    "trad": "健康",
    "pinyin": "jiànkāng",
    "pos": "Vs / N",
    "gloss_en": "",
    "band": "A",
    "level": 1,
    "topic": "健康及身體照護",
    "tags": []
  },
  {
    "id": "A1-0258",
    "trad": "渴",
    "pinyin": "kě",
    "pos": "Vs",
    "gloss_en": "",
    "band": "A",
    "level": 1,
    "topic": "健康及身體照護",
    "tags": []
  },
  {
    "id": "A1-0259",
    "trad": "舒服(˙ㄈㄨ)",
    "pinyin": "shūfu",
    "pos": "Vs",
    "gloss_en": "",
    "band": "A",
    "level": 1,
    "topic": "健康及身體照護",
    "tags": []
  },
  {
    "id": "A1-0260",
    "trad": "眼鏡",
    "pinyin": "yănjìng",
    "pos": "N",
    "gloss_en": "",
    "band": "A",
    "level": 1,
    "topic": "健康及身體照護",
    "tags": []
  },
  {
    "id": "A1-0261",
    "trad": "賣",
    "pinyin": "mài",
    "pos": "V",
    "gloss_en": "",
    "band": "A",
    "level": 1,
    "topic": "購物",
    "tags": []
  },
  {
    "id": "A1-0262",
    "trad": "付",
    "pinyin": "fù",
    "pos": "V",
    "gloss_en": "",
    "band": "A",
    "level": 1,
    "topic": "購物",
    "tags": []
  },
  {
    "id": "A1-0263",
    "trad": "希望",
    "pinyin": "xīwàng",
    "pos": "Vst",
    "gloss_en": "",
    "band": "A",
    "level": 1,
    "topic": "購物",
    "tags": []
  },
  {
    "id": "A1-0264",
    "trad": "書店",
    "pinyin": "shūdiàn",
    "pos": "N",
    "gloss_en": "",
    "band": "A",
    "level": 1,
    "topic": "購物",
    "tags": []
  },
  {
    "id": "A1-0265",
    "trad": "商店",
    "pinyin": "shāngdiàn",
    "pos": "N",
    "gloss_en": "",
    "band": "A",
    "level": 1,
    "topic": "購物",
    "tags": []
  },
  {
    "id": "A1-0266",
    "trad": "市場",
    "pinyin": "shìchăng",
    "pos": "N",
    "gloss_en": "",
    "band": "A",
    "level": 1,
    "topic": "購物",
    "tags": []
  },
  {
    "id": "A1-0267",
    "trad": "超級市場/超市",
    "pinyin": "chāojíshìchăng/chāoshì",
    "pos": "N",
    "gloss_en": "",
    "band": "A",
    "level": 1,
    "topic": "購物",
    "tags": []
  },
  {
    "id": "A1-0268",
    "trad": "信用卡",
    "pinyin": "xìnyòngkă",
    "pos": "N",
    "gloss_en": "",
    "band": "A",
    "level": 1,
    "topic": "購物",
    "tags": []
  },
  {
    "id": "A1-0269",
    "trad": "重要",
    "pinyin": "zhòngyào",
    "pos": "Vs",
    "gloss_en": "",
    "band": "A",
    "level": 1,
    "topic": "購物",
    "tags": []
  },
  {
    "id": "A1-0270",
    "trad": "顏色",
    "pinyin": "yánsè",
    "pos": "N",
    "gloss_en": "",
    "band": "A",
    "level": 1,
    "topic": "購物",
    "tags": []
  },
  {
    "id": "A1-0271",
    "trad": "黃色",
    "pinyin": "huángsè",
    "pos": "N",
    "gloss_en": "",
    "band": "A",
    "level": 1,
    "topic": "購物",
    "tags": []
  },
  {
    "id": "A1-0272",
    "trad": "白色",
    "pinyin": "báisè",
    "pos": "N",
    "gloss_en": "",
    "band": "A",
    "level": 1,
    "topic": "購物",
    "tags": []
  },
  {
    "id": "A1-0273",
    "trad": "手錶/手表/錶/表",
    "pinyin": "shŏubiăo/biăo",
    "pos": "N",
    "gloss_en": "",
    "band": "A",
    "level": 1,
    "topic": "購物",
    "tags": []
  },
  {
    "id": "A1-0274",
    "trad": "襪(子)",
    "pinyin": "wà(zi)",
    "pos": "N",
    "gloss_en": "",
    "band": "A",
    "level": 1,
    "topic": "購物",
    "tags": []
  },
  {
    "id": "A1-0275",
    "trad": "雙",
    "pinyin": "shuāng",
    "pos": "M",
    "gloss_en": "",
    "band": "A",
    "level": 1,
    "topic": "購物",
    "tags": []
  },
  {
    "id": "A1-0276",
    "trad": "裙(子)",
    "pinyin": "qún(zi)",
    "pos": "N",
    "gloss_en": "",
    "band": "A",
    "level": 1,
    "topic": "購物",
    "tags": []
  },
  {
    "id": "A1-0277",
    "trad": "褲(子)",
    "pinyin": "kù(zi)",
    "pos": "N",
    "gloss_en": "",
    "band": "A",
    "level": 1,
    "topic": "購物",
    "tags": []
  },
  {
    "id": "A1-0278",
    "trad": "大衣",
    "pinyin": "dàyī",
    "pos": "N",
    "gloss_en": "",
    "band": "A",
    "level": 1,
    "topic": "購物",
    "tags": []
  },
  {
    "id": "A1-0279",
    "trad": "帽(子)",
    "pinyin": "mào(zi)",
    "pos": "N",
    "gloss_en": "",
    "band": "A",
    "level": 1,
    "topic": "購物",
    "tags": []
  },
  {
    "id": "A1-0280",
    "trad": "皮包",
    "pinyin": "píbāo",
    "pos": "N",
    "gloss_en": "",
    "band": "A",
    "level": 1,
    "topic": "購物",
    "tags": []
  },
  {
    "id": "A1-0281",
    "trad": "外套",
    "pinyin": "wàitào",
    "pos": "N",
    "gloss_en": "",
    "band": "A",
    "level": 1,
    "topic": "購物",
    "tags": []
  },
  {
    "id": "A1-0282",
    "trad": "小心",
    "pinyin": "xiăoxīn",
    "pos": "Vs",
    "gloss_en": "",
    "band": "A",
    "level": 1,
    "topic": "購物",
    "tags": []
  },
  {
    "id": "A1-0283",
    "trad": "比較/較",
    "pinyin": "bĭjiào/jiào",
    "pos": "Adv",
    "gloss_en": "",
    "band": "A",
    "level": 1,
    "topic": "購物",
    "tags": []
  },
  {
    "id": "A1-0284",
    "trad": "差不多",
    "pinyin": "chabùduō",
    "pos": "Vs / Adv",
    "gloss_en": "",
    "band": "A",
    "level": 1,
    "topic": "購物",
    "tags": []
  },
  {
    "id": "A1-0285",
    "trad": "戴",
    "pinyin": "dài",
    "pos": "V",
    "gloss_en": "",
    "band": "A",
    "level": 1,
    "topic": "購物",
    "tags": []
  },
  {
    "id": "A1-0286",
    "trad": "試",
    "pinyin": "shì",
    "pos": "V",
    "gloss_en": "",
    "band": "A",
    "level": 1,
    "topic": "購物",
    "tags": []
  },
  {
    "id": "A1-0287",
    "trad": "輕",
    "pinyin": "qīng",
    "pos": "Vs",
    "gloss_en": "",
    "band": "A",
    "level": 1,
    "topic": "購物",
    "tags": []
  },
  {
    "id": "A1-0288",
    "trad": "重",
    "pinyin": "zhòng",
    "pos": "Vs",
    "gloss_en": "",
    "band": "A",
    "level": 1,
    "topic": "購物",
    "tags": []
  },
  {
    "id": "A1-0289",
    "trad": "樣子",
    "pinyin": "yàngzi",
    "pos": "N",
    "gloss_en": "",
    "band": "A",
    "level": 1,
    "topic": "購物",
    "tags": []
  },
  {
    "id": "A1-0290",
    "trad": "特別",
    "pinyin": "tèbié",
    "pos": "Vs",
    "gloss_en": "",
    "band": "A",
    "level": 1,
    "topic": "購物",
    "tags": []
  },
  {
    "id": "A1-0291",
    "trad": "簡單",
    "pinyin": "jiăndān",
    "pos": "Vs",
    "gloss_en": "",
    "band": "A",
    "level": 1,
    "topic": "購物",
    "tags": []
  },
  {
    "id": "A1-0292",
    "trad": "其他/其它",
    "pinyin": "qítā",
    "pos": "Det",
    "gloss_en": "",
    "band": "A",
    "level": 1,
    "topic": "購物",
    "tags": []
  },
  {
    "id": "A1-0293",
    "trad": "聲音/聲",
    "pinyin": "shēngyīn",
    "pos": "N",
    "gloss_en": "",
    "band": "A",
    "level": 1,
    "topic": "購物",
    "tags": []
  },
  {
    "id": "A1-0294",
    "trad": "好像",
    "pinyin": "hăoxiàng",
    "pos": "Adv",
    "gloss_en": "",
    "band": "A",
    "level": 1,
    "topic": "購物",
    "tags": []
  },
  {
    "id": "A1-0295",
    "trad": "奇怪",
    "pinyin": "qíguài",
    "pos": "Vs",
    "gloss_en": "",
    "band": "A",
    "level": 1,
    "topic": "購物",
    "tags": []
  },
  {
    "id": "A1-0296",
    "trad": "三明治",
    "pinyin": "sānmíngzhì",
    "pos": "N",
    "gloss_en": "",
    "band": "A",
    "level": 1,
    "topic": "飲食",
    "tags": []
  },
  {
    "id": "A1-0297",
    "trad": "漢堡",
    "pinyin": "hànbăo",
    "pos": "N",
    "gloss_en": "",
    "band": "A",
    "level": 1,
    "topic": "飲食",
    "tags": []
  },
  {
    "id": "A1-0298",
    "trad": "蘋果",
    "pinyin": "píngguŏ",
    "pos": "N",
    "gloss_en": "",
    "band": "A",
    "level": 1,
    "topic": "飲食",
    "tags": []
  },
  {
    "id": "A1-0299",
    "trad": "西瓜",
    "pinyin": "xīguā",
    "pos": "N",
    "gloss_en": "",
    "band": "A",
    "level": 1,
    "topic": "飲食",
    "tags": []
  },
  {
    "id": "A1-0300",
    "trad": "啤酒",
    "pinyin": "píjiŭ",
    "pos": "N",
    "gloss_en": "",
    "band": "A",
    "level": 1,
    "topic": "飲食",
    "tags": []
  }
]