[
  {
    "id": "A1-0201",
    "trad": "幫忙",
    "pinyin": "bāngmáng",
    "pos": "V-sep",
    "gloss_en": "",
    "band": "A",
    "level": 1,
    "topic": "與他人的關係",
    "tags": []
  },
  {
    "id": "A1-0202",
    "trad": "幫助",
    "pinyin": "bāngzhù",
    "pos": "V",
    "gloss_en": "",
    "band": "A",
    "level": 1,
    "topic": "與他人的關係",
    "tags": []
  },
  {
    "id": "A1-0203",
    "trad": "小朋友",
    "pinyin": "xiăopéngyŏu",
    "pos": "N",
    "gloss_en": "",
    "band": "A",
    "level": 1,
    "topic": "與他人的關係",
    "tags": []
  },
  {
    "id": "A1-0204",
    "trad": "信",
    "pinyin": "xìn",
    "pos": "N",
    "gloss_en": "",
    "band": "A",
    "level": 1,
    "topic": "與他人的關係",
    "tags": []
  },
  {
    "id": "A1-0205",
    "trad": "信封",
    "pinyin": "xìnfēng",
    "pos": "N",
    "gloss_en": "",
    "band": "A",
    "level": 1,
    "topic": "與他人的關係",
    "tags": []
  },
  {
    "id": "A1-0206",
    "trad": "認識",
    "pinyin": "rènshì",
    "pos": "Vpt",
    "gloss_en": "",
    "band": "A",
    "level": 1,
    "topic": "與他人的關係",
    "tags": []
  },
  {
    "id": "A1-0207",
    "trad": "最近",
    "pinyin": "zuìjìn",
    "pos": "Adv",
    "gloss_en": "",
    "band": "A",
    "level": 1,
    "topic": "與他人的關係",
    "tags": []
  },
  {
    "id": "A1-0208",
    "trad": "聽說",
    "pinyin": "tīngshuō",
    "pos": "V",
    "gloss_en": "",
    "band": "A",
    "level": 1,
    "topic": "與他人的關係",
    "tags": []
  },
  {
    "id": "A1-0209",
    "trad": "見面",
    "pinyin": "jiànmiàn",
    "pos": "V-sep",
    "gloss_en": "",
    "band": "A",
    "level": 1,
    "topic": "與他人的關係",
    "tags": []
  },
  {
    "id": "A1-0210",
    "trad": "事情",
    "pinyin": "shìqíng",
    "pos": "N",
    "gloss_en": "",
    "band": "A",
    "level": 1,
    "topic": "與他人的關係",
    "tags": []
  },
  {
    "id": "A1-0211",
    "trad": "幫",
    "pinyin": "bāng",
    "pos": "V",
    "gloss_en": "",
    "band": "A",
    "level": 1,
    "topic": "與他人的關係",
    "tags": []
  },
  {
    "id": "A1-0212",
    "trad": "錢包",
    "pinyin": "qiánbāo",
    "pos": "N",
    "gloss_en": "",
    "band": "A",
    "level": 1,
    "topic": "與他人的關係",
    "tags": []
  },
  {
    "id": "A1-0213",
    "trad": "拉",
    "pinyin": "lā",
    "pos": "V",
    "gloss_en": "",
    "band": "A",
    "level": 1,
    "topic": "與他人的關係",
    "tags": []
  },
  {
    "id": "A1-0214",
    "trad": "啊",
    "pinyin": "ā",
    "pos": "Ptc",
    "gloss_en": "",
    "band": "A",
    "level": 1,
    "topic": "與他人的關係",
    "tags": []
  },
  {
    "id": "A1-0215",
    "trad": "怎麼辦",
    "pinyin": "zěnmebàn",
    "gloss_en": "",
    "band": "A",
    "level": 1,
    "topic": "與他人的關係",
    "tags": []
  },
  {
    "id": "A1-0216",
    "trad": "車站",
    "pinyin": "chēzhàn",
    "pos": "N",
    "gloss_en": "",
    "band": "A",
    "level": 1,
    "topic": "旅行",
    "tags": []
  },
  {
    "id": "A1-0217",
    "trad": "汽車",
    "pinyin": "qìchē",
    "pos": "N",
    "gloss_en": "",
    "band": "A",
    "level": 1,
    "topic": "旅行",
    "tags": []
  },
  {
    "id": "A1-0218",
    "trad": "飛機場/機場",
    "pinyin": "fēijīchăng/jīchăng",
    "pos": "N",
    "gloss_en": "",
    "band": "A",
    "level": 1,
    "topic": "旅行",
    "tags": []
  },
  {
    "id": "A1-0219",
    "trad": "馬路",
    "pinyin": "mălù",
    "pos": "N",
    "gloss_en": "",
    "band": "A",
    "level": 1,
    "topic": "旅行",
    "tags": []
  },
  {
    "id": "A1-0220",
    "trad": "路口",
    "pinyin": "lùkŏu",
    "pos": "N",
    "gloss_en": "",
    "band": "A",
    "level": 1,
    "topic": "旅行",
    "tags": []
  },
  {
    "id": "A1-0221",
    "trad": "十字路口",
    "pinyin": "shízìlùkŏu",
    "pos": "N",
    "gloss_en": "",
    "band": "A",
    "level": 1,
    "topic": "旅行",
    "tags": []
  },
  {
    "id": "A1-0222",
    "trad": "對面",
    "pinyin": "duìmiàn",
    "pos": "N",
    "gloss_en": "",
    "band": "A",
    "level": 1,
    "topic": "旅行",
    "tags": []
  },
  {
    "id": "A1-0223",
    "trad": "旅行",
    "pinyin": "lǚxíng",
    "pos": "Vi / N",
    "gloss_en": "",
    "band": "A",
    "level": 1,
    "topic": "旅行",
    "tags": []
  },
  {
    "id": "A1-0224",
    "trad": "飯店",
    "pinyin": "fàndiàn",
    "pos": "N",
    "gloss_en": "",
    "band": "A",
    "level": 1,
    "topic": "旅行",
    "tags": []
  },
  {
    "id": "A1-0225",
    "trad": "旅館",
    "pinyin": "lǚguăn",
    "pos": "N",
    "gloss_en": "",
    "band": "A",
    "level": 1,
    "topic": "旅行",
    "tags": []
  },
  {
    "id": "A1-0226",
    "trad": "袋子",
    "pinyin": "dàizi",
    "pos": "N",
    "gloss_en": "",
    "band": "A",
    "level": 1,
    "topic": "旅行",
    "tags": []
  },
  {
    "id": "A1-0227",
    "trad": "參觀",
    "pinyin": "cānguān",
    "pos": "V",
    "gloss_en": "",
    "band": "A",
    "level": 1,
    "topic": "旅行",
    "tags": []
  },
  {
    "id": "A1-0228",
    "trad": "地圖",
    "pinyin": "dìtú",
    "pos": "N",
    "gloss_en": "",
    "band": "A",
    "level": 1,
    "topic": "旅行",
    "tags": []
  },
  {
    "id": "A1-0229",
    "trad": "照相機/相機",
    "pinyin": "zhàoxiàngjī/xiàngjī",
    "pos": "N",
    "gloss_en": "",
    "band": "A",
    "level": 1,
    "topic": "旅行",
    "tags": []
  },
  {
    "id": "A1-0230",
    "trad": "照相",
    "pinyin": "zhàoxiàng",
    "pos": "V-sep",
    "gloss_en": "",
    "band": "A",
    "level": 1,
    "topic": "旅行",
    "tags": []
  },
  {
    "id": "A1-0231",
    "trad": "照片/相片/相片兒",
    "pinyin": "zhàopiàn/xiàngpiàn/xiàngpiànr",
    "pos": "N",
    "gloss_en": "",
    "band": "A",
    "level": 1,
    "topic": "旅行",
    "tags": []
  },
  {
    "id": "A1-0232",
    "trad": "風景",
    "pinyin": "fēngjĭng",
    "pos": "N",
    "gloss_en": "",
    "band": "A",
    "level": 1,
    "topic": "旅行",
    "tags": []
  },
  {
    "id": "A1-0233",
    "trad": "南/南部",
    "pinyin": "nán/nánbù",
    "pos": "N",
    "gloss_en": "",
    "band": "A",
    "level": 1,
    "topic": "旅行",
    "tags": []
  },
  {
    "id": "A1-0234",
    "trad": "西/西部",
    "pinyin": "xī/ xībù",
    "pos": "N",
    "gloss_en": "",
    "band": "A",
    "level": 1,
    "topic": "旅行",
    "tags": []
  },
  {
    "id": "A1-0235",
    "trad": "北/北部",
    "pinyin": "běi/běibù",
    "pos": "N",
    "gloss_en": "",
    "band": "A",
    "level": 1,
    "topic": "旅行",
    "tags": []
  },
  {
    "id": "A1-0236",
    "trad": "東/東部",
    "pinyin": "dōng/dōngbù",
    "pos": "N",
    "gloss_en": "",
    "band": "A",
    "level": 1,
    "topic": "旅行",
    "tags": []
  },
  {
    "id": "A1-0237",
    "trad": "中間",
    "pinyin": "zhōngjiān",
    "pos": "N",
    "gloss_en": "",
    "band": "A",
    "level": 1,
    "topic": "旅行",
    "tags": []
  },
  {
    "id": "A1-0238",
    "trad": "離",
    "pinyin": "lí",
    "pos": "Prep",
    "gloss_en": "",
    "band": "A",
    "level": 1,
    "topic": "旅行",
    "tags": []
  },
  {
    "id": "A1-0239",
    "trad": "離開",
    "pinyin": "líkāi",
    "pos": "Vp",
    "gloss_en": "",
    "band": "A",
    "level": 1,
    "topic": "旅行",
    "tags": []
  },
  {
    "id": "A1-0240",
    "trad": "經過",
    "pinyin": "jīngguò",
    "pos": "V",
    "gloss_en": "",
    "band": "A",
    "level": 1,
    "topic": "旅行",
    "tags": []
  },
  {
    "id": "A1-0241",
    "trad": "往",
    "pinyin": "wăng",
    "pos": "Prep",
    "gloss_en": "",
    "band": "A",
    "level": 1,
    "topic": "旅行",
    "tags": []
  },
  {
    "id": "A1-0242",
    "trad": "送",
    "pinyin": "sòng",
    "pos": "V",
    "gloss_en": "",
    "band": "A",
    "level": 1,
    "topic": "旅行",
    "tags": []
  },
  {
    "id": "A1-0243",
    "trad": "放",
    "pinyin": "fàng",
    "pos": "V",
    "gloss_en": "",
    "band": "A",
    "level": 1,
    "topic": "旅行",
    "tags": []
  },
  {
    "id": "A1-0244",
    "trad": "近",
    "pinyin": "jìn",
    "pos": "Vs",
    "gloss_en": "",
    "band": "A",
    "level": 1,
    "topic": "旅行",
    "tags": []
  },
  {
    "id": "A1-0245",
    "trad": "遠",
    "pinyin": "yuăn",
    "pos": "Vs",
    "gloss_en": "",
    "band": "A",
    "level": 1,
    "topic": "旅行",
    "tags": []
  },
  {
    "id": "A1-0246",
    "trad": "向",
    "pinyin": "xiàng",
    "pos": "Prep",
    "gloss_en": "",
    "band": "A",
    "level": 1,
    "topic": "旅行",
    "tags": []
  },
  {
    "id": "A1-0247",
    "trad": "轉",
    "pinyin": "zhuăn",
    "pos": "V",
    "gloss_en": "",
    "band": "A",
    "level": 1,
    "topic": "旅行",
    "tags": []
  },
  {
    "id": "A1-0248",
    "trad": "掉",
    "pinyin": "diào",
    "pos": "Vpt",
    "gloss_en": "",
    "band": "A",
    "level": 1,
    "topic": "旅行",
    "tags": []
  },
  {
    "id": "A1-0249",
    "trad": "一直",
    "pinyin": "yīzhí",
    "pos": "Adv",
    "gloss_en": "",
    "band": "A",
    "level": 1,
    "topic": "旅行",
    "tags": []
  },
  {
    "id": "A1-0250",
    "trad": "最後",
    "pinyin": "zuìhòu",
    "pos": "N",
    "gloss_en": "",
    "band": "A",
    "level": 1,
    "topic": "旅行",
    "tags": []
  }
]