[
  {
    "id": "A2-0233",
    "trad": "陪",
    "pinyin": "péi",
    "pos": "V",
    "gloss_en": "",
    "band": "A",
    "level": 2,
    "topic": "與他人的關係",
    "tags": []
  },
  {
    "id": "A2-0234",
    "trad": "利用",
    "pinyin": "lìyòng",
    "pos": "V",
    "gloss_en": "",
    "band": "A",
    "level": 2,
    "topic": "與他人的關係",
    "tags": []
  },
  {
    "id": "A2-0235",
    "trad": "好處",
    "pinyin": "hăochù",
    "pos": "N",
    "gloss_en": "",
    "band": "A",
    "level": 2,
    "topic": "與他人的關係",
    "tags": []
  },
  {
    "id": "A2-0236",
    "trad": "壞處",
    "pinyin": "huàichù",
    "pos": "N",
    "gloss_en": "",
    "band": "A",
    "level": 2,
    "topic": "與他人的關係",
    "tags": []
  },
  {
    "id": "A2-0237",
    "trad": "目的",
    "pinyin": "mùdì",
    "pos": "N",
    "gloss_en": "",
    "band": "A",
    "level": 2,
    "topic": "與他人的關係",
    "tags": []
  },
  {
    "id": "A2-0238",
    "trad": "要求",
    "pinyin": "yāoqiú",
    "pos": "N / V",
    "gloss_en": "",
    "band": "A",
    "level": 2,
    "topic": "與他人的關係",
    "tags": []
  },
  {
    "id": "A2-0239",
    "trad": "合作",
    "pinyin": "hézuò",
    "pos": "Vs",
    "gloss_en": "",
    "band": "A",
    "level": 2,
    "topic": "與他人的關係",
    "tags": []
  },
  {
    "id": "A2-0240",
    "trad": "主人",
    "pinyin": "zhǔrén",
    "pos": "N",
    "gloss_en": "",
    "band": "A",
    "level": 2,
    "topic": "與他人的關係",
    "tags": []
  },
  {
    "id": "A2-0241",
    "trad": "請客",
    "pinyin": "qĭngkè",
    "pos": "V-sep",
    "gloss_en": "",
    "band": "A",
    "level": 2,
    "topic": "與他人的關係",
    "tags": []
  },
  {
    "id": "A2-0242",
    "trad": "約",
    "pinyin": "yuē",
    "pos": "V",
    "gloss_en": "",
    "band": "A",
    "level": 2,
    "topic": "與他人的關係",
    "tags": []
  },
  {
    "id": "A2-0243",
    "trad": "約會",
    "pinyin": "yuēhuì",
    "pos": "N / Vi",
    "gloss_en": "",
    "band": "A",
    "level": 2,
    "topic": "與他人的關係",
    "tags": []
  },
  {
    "id": "A2-0244",
    "trad": "派對",
    "pinyin": "pàiduì",
    "pos": "N",
    "gloss_en": "",
    "band": "A",
    "level": 2,
    "topic": "與他人的關係",
    "tags": []
  },
  {
    "id": "A2-0245",
    "trad": "祝",
    "pinyin": "zhù",
    "pos": "V",
    "gloss_en": "",
    "band": "A",
    "level": 2,
    "topic": "與他人的關係",
    "tags": []
  },
  {
    "id": "A2-0246",
    "trad": "留",
    "pinyin": "liú",
    "pos": "V",
    "gloss_en": "",
    "band": "A",
    "level": 2,
    "topic": "與他人的關係",
    "tags": []
  },
  {
    "id": "A2-0247",
    "trad": "封",
    "pinyin": "fēng",
    "pos": "M",
    "gloss_en": "",
    "band": "A",
    "level": 2,
    "topic": "與他人的關係",
    "tags": []
  },
  {
    "id": "A2-0248",
    "trad": "信箱",
    "pinyin": "xìnxiāng",
    "pos": "N",
    "gloss_en": "",
    "band": "A",
    "level": 2,
    "topic": "與他人的關係",
    "tags": []
  },
  {
    "id": "A2-0249",
    "trad": "郵票",
    "pinyin": "yóupiào",
    "pos": "N",
    "gloss_en": "",
    "band": "A",
    "level": 2,
    "topic": "與他人的關係",
    "tags": []
  },
  {
    "id": "A2-0250",
    "trad": "回信",
    "pinyin": "huíxìn",
    "pos": "V-sep",
    "gloss_en": "",
    "band": "A",
    "level": 2,
    "topic": "與他人的關係",
    "tags": []
  },
  {
    "id": "A2-0251",
    "trad": "郵件",
    "pinyin": "yóujiàn",
    "pos": "N",
    "gloss_en": "",
    "band": "A",
    "level": 2,
    "topic": "與他人的關係",
    "tags": []
  },
  {
    "id": "A2-0252",
    "trad": "弄",
    "pinyin": "nòng",
    "pos": "V",
    "gloss_en": "",
    "band": "A",
    "level": 2,
    "topic": "與他人的關係",
    "tags": []
  },
  {
    "id": "A2-0253",
    "trad": "放心",
    "pinyin": "fàngxīn",
    "pos": "Vs-sep",
    "gloss_en": "",
    "band": "A",
    "level": 2,
    "topic": "與他人的關係",
    "tags": []
  },
  {
    "id": "A2-0254",
    "trad": "偷",
    "pinyin": "tōu",
    "pos": "V",
    "gloss_en": "",
    "band": "A",
    "level": 2,
    "topic": "與他人的關係",
    "tags": []
  },
  {
    "id": "A2-0255",
    "trad": "滿",
    "pinyin": "măn",
    "pos": "Vp",
    "gloss_en": "",
    "band": "A",
    "level": 2,
    "topic": "與他人的關係",
    "tags": []
  },
  {
    "id": "A2-0256",
    "trad": "丟",
    "pinyin": "diū",
    "pos": "V",
    "gloss_en": "",
    "band": "A",
    "level": 2,
    "topic": "與他人的關係",
    "tags": []
  },
  {
    "id": "A2-0257",
    "trad": "換",
    "pinyin": "huàn",
    "pos": "V",
    "gloss_en": "",
    "band": "A",
    "level": 2,
    "topic": "與他人的關係",
    "tags": []
  },
  {
    "id": "A2-0258",
    "trad": "一塊/一塊兒",
    "pinyin": "yīkuài/yīkuàir",
    "pos": "Adv",
    "gloss_en": "",
    "band": "A",
    "level": 2,
    "topic": "與他人的關係",
    "tags": []
  },
  {
    "id": "A2-0259",
    "trad": "同時",
    "pinyin": "tóngshí",
    "pos": "N",
    "gloss_en": "",
    "band": "A",
    "level": 2,
    "topic": "與他人的關係",
    "tags": []
  },
  {
    "id": "A2-0260",
    "trad": "保護",
    "pinyin": "băohù",
    "pos": "V",
    "gloss_en": "",
    "band": "A",
    "level": 2,
    "topic": "與他人的關係",
    "tags": []
  },
  {
    "id": "A2-0261",
    "trad": "出門",
    "pinyin": "chūmén",
    "pos": "V-sep",
    "gloss_en": "",
    "band": "A",
    "level": 2,
    "topic": "與他人的關係",
    "tags": []
  },
  {
    "id": "A2-0262",
    "trad": "現代",
    "pinyin": "xiàndài",
    "pos": "N / Vs",
    "gloss_en": "",
    "band": "A",
    "level": 2,
    "topic": "與他人的關係",
    "tags": []
  },
  {
    "id": "A2-0263",
    "trad": "傳統",
    "pinyin": "chuántŏng",
    "pos": "Vs",
    "gloss_en": "",
    "band": "A",
    "level": 2,
    "topic": "與他人的關係",
    "tags": []
  },
  {
    "id": "A2-0264",
    "trad": "除夕",
    "pinyin": "chúxì",
    "pos": "N",
    "gloss_en": "",
    "band": "A",
    "level": 2,
    "topic": "與他人的關係",
    "tags": []
  },
  {
    "id": "A2-0265",
    "trad": "春節",
    "pinyin": "chūnjié",
    "pos": "N",
    "gloss_en": "",
    "band": "A",
    "level": 2,
    "topic": "與他人的關係",
    "tags": []
  },
  {
    "id": "A2-0266",
    "trad": "節日",
    "pinyin": "jiérì",
    "pos": "N",
    "gloss_en": "",
    "band": "A",
    "level": 2,
    "topic": "與他人的關係",
    "tags": []
  },
  {
    "id": "A2-0267",
    "trad": "帶來",
    "pinyin": "dàilái",
    "pos": "V",
    "gloss_en": "",
    "band": "A",
    "level": 2,
    "topic": "與他人的關係",
    "tags": []
  },
  {
    "id": "A2-0268",
    "trad": "當中",
    "pinyin": "dāngzhōng",
    "pos": "N",
    "gloss_en": "",
    "band": "A",
    "level": 2,
    "topic": "與他人的關係",
    "tags": []
  },
  {
    "id": "A2-0269",
    "trad": "法律",
    "pinyin": "fălǜ",
    "pos": "N",
    "gloss_en": "",
    "band": "A",
    "level": 2,
    "topic": "與他人的關係",
    "tags": []
  },
  {
    "id": "A2-0270",
    "trad": "方面",
    "pinyin": "fāngmiàn",
    "pos": "N",
    "gloss_en": "",
    "band": "A",
    "level": 2,
    "topic": "與他人的關係",
    "tags": []
  },
  {
    "id": "A2-0271",
    "trad": "開玩笑",
    "pinyin": "kāiwánxiào",
    "pos": "V-sep",
    "gloss_en": "",
    "band": "A",
    "level": 2,
    "topic": "與他人的關係",
    "tags": []
  },
  {
    "id": "A2-0272",
    "trad": "可惜",
    "pinyin": "kěxí",
    "pos": "Vs",
    "gloss_en": "",
    "band": "A",
    "level": 2,
    "topic": "與他人的關係",
    "tags": []
  },
  {
    "id": "A2-0273",
    "trad": "老太太(˙ㄊㄞ)",
    "pinyin": "lăotàitai",
    "pos": "N",
    "gloss_en": "",
    "band": "A",
    "level": 2,
    "topic": "與他人的關係",
    "tags": []
  },
  {
    "id": "A2-0274",
    "trad": "有名",
    "pinyin": "yŏumíng",
    "pos": "Vs",
    "gloss_en": "",
    "band": "A",
    "level": 2,
    "topic": "與他人的關係",
    "tags": []
  },
  {
    "id": "A2-0275",
    "trad": "自由",
    "pinyin": "zìyóu",
    "pos": "N / Vs",
    "gloss_en": "",
    "band": "A",
    "level": 2,
    "topic": "與他人的關係",
    "tags": []
  },
  {
    "id": "A2-0276",
    "trad": "社會",
    "pinyin": "shèhuì",
    "pos": "N",
    "gloss_en": "",
    "band": "A",
    "level": 2,
    "topic": "與他人的關係",
    "tags": []
  }
]