[
  {
    "id": "A2a-0001",
    "trad": "環境",
    "pinyin": "huánjìng",
    "pos": "N",
    "gloss_en": "",
    "band": "A",
    "level": 2,
    "topic": "環境",
    "tags": []
  },
  {
    "id": "A2a-0002",
    "trad": "習慣",
    "pinyin": "xíguàn",
    "pos": "N",
    "gloss_en": "",
    "band": "A",
    "level": 2,
    "topic": "日常生活",
    "tags": []
  }
]

