[
  {
    "id": "A1-0051",
    "trad": "上班",
    "pinyin": "shàngbān",
    "pos": "V-sep",
    "gloss_en": "",
    "band": "A",
    "level": 1,
    "topic": "工作",
    "tags": []
  },
  {
    "id": "A1-0052",
    "trad": "下班",
    "pinyin": "xiàbān",
    "pos": "V-sep",
    "gloss_en": "",
    "band": "A",
    "level": 1,
    "topic": "工作",
    "tags": []
  },
  {
    "id": "A1-0053",
    "trad": "能力",
    "pinyin": "nénglì",
    "pos": "N",
    "gloss_en": "",
    "band": "A",
    "level": 1,
    "topic": "工作",
    "tags": []
  },
  {
    "id": "A1-0054",
    "trad": "努力",
    "pinyin": "nǔlì",
    "pos": "Vs",
    "gloss_en": "",
    "band": "A",
    "level": 1,
    "topic": "工作",
    "tags": []
  },
  {
    "id": "A1-0055",
    "trad": "準備",
    "pinyin": "zhǔnbèi",
    "pos": "V",
    "gloss_en": "",
    "band": "A",
    "level": 1,
    "topic": "工作",
    "tags": []
  },
  {
    "id": "A1-0056",
    "trad": "打算",
    "pinyin": "dăsuàn",
    "pos": "Vaux",
    "gloss_en": "",
    "band": "A",
    "level": 1,
    "topic": "工作",
    "tags": []
  },
  {
    "id": "A1-0057",
    "trad": "計畫/計劃",
    "pinyin": "jìhuà",
    "pos": "V / N",
    "gloss_en": "",
    "band": "A",
    "level": 1,
    "topic": "工作",
    "tags": []
  },
  {
    "id": "A1-0058",
    "trad": "機會",
    "pinyin": "jīhuì",
    "pos": "N",
    "gloss_en": "",
    "band": "A",
    "level": 1,
    "topic": "工作",
    "tags": []
  },
  {
    "id": "A1-0059",
    "trad": "如果",
    "pinyin": "rúguŏ",
    "pos": "Conj",
    "gloss_en": "",
    "band": "A",
    "level": 1,
    "topic": "工作",
    "tags": []
  },
  {
    "id": "A1-0060",
    "trad": "小學",
    "pinyin": "xiăoxué",
    "pos": "N",
    "gloss_en": "",
    "band": "A",
    "level": 1,
    "topic": "教育",
    "tags": []
  },
  {
    "id": "A1-0061",
    "trad": "高中",
    "pinyin": "gāozhōng",
    "pos": "N",
    "gloss_en": "",
    "band": "A",
    "level": 1,
    "topic": "教育",
    "tags": []
  },
  {
    "id": "A1-0062",
    "trad": "上學",
    "pinyin": "shàngxué",
    "pos": "V-sep",
    "gloss_en": "",
    "band": "A",
    "level": 1,
    "topic": "教育",
    "tags": []
  },
  {
    "id": "A1-0063",
    "trad": "開學",
    "pinyin": "kāixué",
    "pos": "Vp",
    "gloss_en": "",
    "band": "A",
    "level": 1,
    "topic": "教育",
    "tags": []
  },
  {
    "id": "A1-0064",
    "trad": "班",
    "pinyin": "bān",
    "pos": "M / N",
    "gloss_en": "",
    "band": "A",
    "level": 1,
    "topic": "教育",
    "tags": []
  },
  {
    "id": "A1-0065",
    "trad": "年級",
    "pinyin": "niánjí",
    "pos": "N",
    "gloss_en": "",
    "band": "A",
    "level": 1,
    "topic": "教育",
    "tags": []
  },
  {
    "id": "A1-0066",
    "trad": "作業",
    "pinyin": "zuòyè",
    "pos": "N",
    "gloss_en": "",
    "band": "A",
    "level": 1,
    "topic": "教育",
    "tags": []
  },
  {
    "id": "A1-0067",
    "trad": "成績",
    "pinyin": "chéngjī",
    "pos": "N",
    "gloss_en": "",
    "band": "A",
    "level": 1,
    "topic": "教育",
    "tags": []
  },
  {
    "id": "A1-0068",
    "trad": "語言",
    "pinyin": "yǔyán",
    "pos": "N",
    "gloss_en": "",
    "band": "A",
    "level": 1,
    "topic": "教育",
    "tags": []
  },
  {
    "id": "A1-0069",
    "trad": "華語/華文",
    "pinyin": "huáyǔ/huáwén",
    "pos": "N",
    "gloss_en": "",
    "band": "A",
    "level": 1,
    "topic": "教育",
    "tags": []
  },
  {
    "id": "A1-0070",
    "trad": "黑板",
    "pinyin": "hēibăn",
    "pos": "N",
    "gloss_en": "",
    "band": "A",
    "level": 1,
    "topic": "教育",
    "tags": []
  },
  {
    "id": "A1-0071",
    "trad": "課本",
    "pinyin": "kèběn",
    "pos": "N",
    "gloss_en": "",
    "band": "A",
    "level": 1,
    "topic": "教育",
    "tags": []
  },
  {
    "id": "A1-0072",
    "trad": "字典",
    "pinyin": "zìdiăn",
    "pos": "N",
    "gloss_en": "",
    "band": "A",
    "level": 1,
    "topic": "教育",
    "tags": []
  },
  {
    "id": "A1-0073",
    "trad": "注意",
    "pinyin": "zhùyì",
    "pos": "Vst",
    "gloss_en": "",
    "band": "A",
    "level": 1,
    "topic": "教育",
    "tags": []
  },
  {
    "id": "A1-0074",
    "trad": "讀書",
    "pinyin": "dúshū",
    "pos": "V-sep",
    "gloss_en": "",
    "band": "A",
    "level": 1,
    "topic": "教育",
    "tags": []
  },
  {
    "id": "A1-0075",
    "trad": "回答",
    "pinyin": "huídá",
    "pos": "V/N",
    "gloss_en": "",
    "band": "A",
    "level": 1,
    "topic": "教育",
    "tags": []
  },
  {
    "id": "A1-0076",
    "trad": "答",
    "pinyin": "dá",
    "pos": "V",
    "gloss_en": "",
    "band": "A",
    "level": 1,
    "topic": "教育",
    "tags": []
  },
  {
    "id": "A1-0077",
    "trad": "句",
    "pinyin": "jù",
    "pos": "M",
    "gloss_en": "",
    "band": "A",
    "level": 1,
    "topic": "教育",
    "tags": []
  },
  {
    "id": "A1-0078",
    "trad": "圖",
    "pinyin": "tú",
    "pos": "N",
    "gloss_en": "",
    "band": "A",
    "level": 1,
    "topic": "教育",
    "tags": []
  },
  {
    "id": "A1-0079",
    "trad": "部分(˙ㄈㄣ)/部份(˙ㄈㄣ)",
    "pinyin": "bùfen",
    "pos": "Det / N",
    "gloss_en": "",
    "band": "A",
    "level": 1,
    "topic": "教育",
    "tags": []
  },
  {
    "id": "A1-0080",
    "trad": "想法",
    "pinyin": "xiăngfă",
    "pos": "N",
    "gloss_en": "",
    "band": "A",
    "level": 1,
    "topic": "教育",
    "tags": []
  },
  {
    "id": "A1-0081",
    "trad": "學習",
    "pinyin": "xuéxí",
    "pos": "V",
    "gloss_en": "",
    "band": "A",
    "level": 1,
    "topic": "教育",
    "tags": []
  },
  {
    "id": "A1-0082",
    "trad": "練習",
    "pinyin": "liànxí",
    "pos": "V / N",
    "gloss_en": "",
    "band": "A",
    "level": 1,
    "topic": "教育",
    "tags": []
  },
  {
    "id": "A1-0083",
    "trad": "參加",
    "pinyin": "cānjiā",
    "pos": "V",
    "gloss_en": "",
    "band": "A",
    "level": 1,
    "topic": "教育",
    "tags": []
  },
  {
    "id": "A1-0084",
    "trad": "文化",
    "pinyin": "wénhuà",
    "pos": "N",
    "gloss_en": "",
    "band": "A",
    "level": 1,
    "topic": "教育",
    "tags": []
  },
  {
    "id": "A1-0085",
    "trad": "認為",
    "pinyin": "rènwéi",
    "pos": "V",
    "gloss_en": "",
    "band": "A",
    "level": 1,
    "topic": "教育",
    "tags": []
  },
  {
    "id": "A1-0086",
    "trad": "清楚",
    "pinyin": "qīngchŭ",
    "pos": "Vs",
    "gloss_en": "",
    "band": "A",
    "level": 1,
    "topic": "教育",
    "tags": []
  },
  {
    "id": "A1-0087",
    "trad": "決定",
    "pinyin": "juédìng",
    "pos": "N / Vp",
    "gloss_en": "",
    "band": "A",
    "level": 1,
    "topic": "教育",
    "tags": []
  },
  {
    "id": "A1-0088",
    "trad": "記得",
    "pinyin": "jìde",
    "pos": "Vst",
    "gloss_en": "",
    "band": "A",
    "level": 1,
    "topic": "教育",
    "tags": []
  },
  {
    "id": "A1-0089",
    "trad": "忘",
    "pinyin": "wàng",
    "pos": "Vp",
    "gloss_en": "",
    "band": "A",
    "level": 1,
    "topic": "教育",
    "tags": []
  },
  {
    "id": "A1-0090",
    "trad": "棒",
    "pinyin": "bàng",
    "pos": "Vs",
    "gloss_en": "",
    "band": "A",
    "level": 1,
    "topic": "教育",
    "tags": []
  },
  {
    "id": "A1-0091",
    "trad": "行",
    "pinyin": "xíng",
    "pos": "Vs",
    "gloss_en": "",
    "band": "A",
    "level": 1,
    "topic": "教育",
    "tags": []
  },
  {
    "id": "A1-0092",
    "trad": "行",
    "pinyin": "háng",
    "pos": "M",
    "gloss_en": "",
    "band": "A",
    "level": 1,
    "topic": "教育",
    "tags": []
  },
  {
    "id": "A1-0093",
    "trad": "講",
    "pinyin": "jiăng",
    "pos": "V",
    "gloss_en": "",
    "band": "A",
    "level": 1,
    "topic": "教育",
    "tags": []
  },
  {
    "id": "A1-0094",
    "trad": "加",
    "pinyin": "jiā",
    "pos": "V",
    "gloss_en": "",
    "band": "A",
    "level": 1,
    "topic": "教育",
    "tags": []
  },
  {
    "id": "A1-0095",
    "trad": "算",
    "pinyin": "suàn",
    "pos": "V",
    "gloss_en": "",
    "band": "A",
    "level": 1,
    "topic": "教育",
    "tags": []
  },
  {
    "id": "A1-0096",
    "trad": "交",
    "pinyin": "jiāo",
    "pos": "V",
    "gloss_en": "",
    "band": "A",
    "level": 1,
    "topic": "教育",
    "tags": []
  },
  {
    "id": "A1-0097",
    "trad": "借",
    "pinyin": "jiè",
    "pos": "V",
    "gloss_en": "",
    "band": "A",
    "level": 1,
    "topic": "教育",
    "tags": []
  },
  {
    "id": "A1-0098",
    "trad": "還",
    "pinyin": "huán",
    "pos": "V",
    "gloss_en": "",
    "band": "A",
    "level": 1,
    "topic": "教育",
    "tags": []
  },
  {
    "id": "A1-0099",
    "trad": "辦法",
    "pinyin": "bànfă",
    "pos": "N",
    "gloss_en": "",
    "band": "A",
    "level": 1,
    "topic": "教育",
    "tags": []
  },
  {
    "id": "A1-0100",
    "trad": "方法",
    "pinyin": "fāngfă",
    "pos": "N",
    "gloss_en": "",
    "band": "A",
    "level": 1,
    "topic": "教育",
    "tags": []
  }
]