[
  {
    "id": "A2-0101",
    "trad": "暑假",
    "pinyin": "shŭjià",
    "pos": "N",
    "gloss_en": "",
    "band": "A",
    "level": 2,
    "topic": "教育",
    "tags": []
  },
  {
    "id": "A2-0102",
    "trad": "寒假",
    "pinyin": "hánjià",
    "pos": "N",
    "gloss_en": "",
    "band": "A",
    "level": 2,
    "topic": "教育",
    "tags": []
  },
  {
    "id": "A2-0103",
    "trad": "假",
    "pinyin": "jià",
    "pos": "N",
    "gloss_en": "",
    "band": "A",
    "level": 2,
    "topic": "教育",
    "tags": []
  },
  {
    "id": "A2-0104",
    "trad": "畢業",
    "pinyin": "bìyè",
    "pos": "Vp-sep",
    "gloss_en": "",
    "band": "A",
    "level": 2,
    "topic": "教育",
    "tags": []
  },
  {
    "id": "A2-0105",
    "trad": "學期",
    "pinyin": "xuéqí",
    "pos": "N",
    "gloss_en": "",
    "band": "A",
    "level": 2,
    "topic": "教育",
    "tags": []
  },
  {
    "id": "A2-0106",
    "trad": "服務",
    "pinyin": "fúwù",
    "pos": "V",
    "gloss_en": "",
    "band": "A",
    "level": 2,
    "topic": "教育",
    "tags": []
  },
  {
    "id": "A2-0107",
    "trad": "室友",
    "pinyin": "shìyŏu",
    "pos": "N",
    "gloss_en": "",
    "band": "A",
    "level": 2,
    "topic": "教育",
    "tags": []
  },
  {
    "id": "A2-0108",
    "trad": "操場",
    "pinyin": "cāochăng",
    "pos": "N",
    "gloss_en": "",
    "band": "A",
    "level": 2,
    "topic": "教育",
    "tags": []
  },
  {
    "id": "A2-0109",
    "trad": "校園",
    "pinyin": "xiàoyuán",
    "pos": "N",
    "gloss_en": "",
    "band": "A",
    "level": 2,
    "topic": "教育",
    "tags": []
  },
  {
    "id": "A2-0110",
    "trad": "位子",
    "pinyin": "wèizi",
    "pos": "N",
    "gloss_en": "",
    "band": "A",
    "level": 2,
    "topic": "教育",
    "tags": []
  },
  {
    "id": "A2-0111",
    "trad": "書桌",
    "pinyin": "shūzhuō",
    "pos": "N",
    "gloss_en": "",
    "band": "A",
    "level": 2,
    "topic": "教育",
    "tags": []
  },
  {
    "id": "A2-0112",
    "trad": "書包",
    "pinyin": "shūbāo",
    "pos": "N",
    "gloss_en": "",
    "band": "A",
    "level": 2,
    "topic": "教育",
    "tags": []
  },
  {
    "id": "A2-0113",
    "trad": "書架",
    "pinyin": "shūjià",
    "pos": "N",
    "gloss_en": "",
    "band": "A",
    "level": 2,
    "topic": "教育",
    "tags": []
  },
  {
    "id": "A2-0114",
    "trad": "本子",
    "pinyin": "běnzi",
    "pos": "N",
    "gloss_en": "",
    "band": "A",
    "level": 2,
    "topic": "教育",
    "tags": []
  },
  {
    "id": "A2-0115",
    "trad": "尺",
    "pinyin": "chĭ",
    "pos": "N",
    "gloss_en": "",
    "band": "A",
    "level": 2,
    "topic": "教育",
    "tags": []
  },
  {
    "id": "A2-0116",
    "trad": "討論",
    "pinyin": "tăolùn",
    "pos": "V",
    "gloss_en": "",
    "band": "A",
    "level": 2,
    "topic": "教育",
    "tags": []
  },
  {
    "id": "A2-0117",
    "trad": "同意",
    "pinyin": "tóngyì",
    "pos": "Vst",
    "gloss_en": "",
    "band": "A",
    "level": 2,
    "topic": "教育",
    "tags": []
  },
  {
    "id": "A2-0118",
    "trad": "了解/瞭解",
    "pinyin": "liăojiě",
    "pos": "Vst",
    "gloss_en": "",
    "band": "A",
    "level": 2,
    "topic": "教育",
    "tags": []
  },
  {
    "id": "A2-0119",
    "trad": "無聊",
    "pinyin": "wúliáo",
    "pos": "Vs",
    "gloss_en": "",
    "band": "A",
    "level": 2,
    "topic": "教育",
    "tags": []
  },
  {
    "id": "A2-0120",
    "trad": "有趣",
    "pinyin": "yŏuqù",
    "pos": "Vs",
    "gloss_en": "",
    "band": "A",
    "level": 2,
    "topic": "教育",
    "tags": []
  },
  {
    "id": "A2-0121",
    "trad": "有意思(˙ㄙ)",
    "pinyin": "yŏuyìsi",
    "pos": "Vs",
    "gloss_en": "",
    "band": "A",
    "level": 2,
    "topic": "教育",
    "tags": []
  },
  {
    "id": "A2-0122",
    "trad": "原因",
    "pinyin": "yuányīn",
    "pos": "N",
    "gloss_en": "",
    "band": "A",
    "level": 2,
    "topic": "教育",
    "tags": []
  },
  {
    "id": "A2-0123",
    "trad": "遍",
    "pinyin": "biàn",
    "pos": "M",
    "gloss_en": "",
    "band": "A",
    "level": 2,
    "topic": "教育",
    "tags": []
  },
  {
    "id": "A2-0124",
    "trad": "改",
    "pinyin": "găi",
    "pos": "V",
    "gloss_en": "",
    "band": "A",
    "level": 2,
    "topic": "教育",
    "tags": []
  },
  {
    "id": "A2-0125",
    "trad": "忘記",
    "pinyin": "wàngjì",
    "pos": "Vpt",
    "gloss_en": "",
    "band": "A",
    "level": 2,
    "topic": "教育",
    "tags": []
  },
  {
    "id": "A2-0126",
    "trad": "程度",
    "pinyin": "chéngdù",
    "pos": "N",
    "gloss_en": "",
    "band": "A",
    "level": 2,
    "topic": "教育",
    "tags": []
  },
  {
    "id": "A2-0127",
    "trad": "趕快",
    "pinyin": "gănkuài",
    "pos": "Adv",
    "gloss_en": "",
    "band": "A",
    "level": 2,
    "topic": "教育",
    "tags": []
  },
  {
    "id": "A2-0128",
    "trad": "以上",
    "pinyin": "yĭshàng",
    "pos": "N",
    "gloss_en": "",
    "band": "A",
    "level": 2,
    "topic": "教育",
    "tags": []
  },
  {
    "id": "A2-0129",
    "trad": "以下",
    "pinyin": "yĭxià",
    "pos": "N",
    "gloss_en": "",
    "band": "A",
    "level": 2,
    "topic": "教育",
    "tags": []
  },
  {
    "id": "A2-0130",
    "trad": "意見",
    "pinyin": "yìjiàn",
    "pos": "N",
    "gloss_en": "",
    "band": "A",
    "level": 2,
    "topic": "教育",
    "tags": []
  },
  {
    "id": "A2-0131",
    "trad": "用功",
    "pinyin": "yònggōng",
    "pos": "Vs",
    "gloss_en": "",
    "band": "A",
    "level": 2,
    "topic": "教育",
    "tags": []
  },
  {
    "id": "A2-0132",
    "trad": "研究",
    "pinyin": "yánjiù",
    "pos": "N / V",
    "gloss_en": "",
    "band": "A",
    "level": 2,
    "topic": "教育",
    "tags": []
  },
  {
    "id": "A2-0133",
    "trad": "教育",
    "pinyin": "jiàoyù",
    "pos": "N / V",
    "gloss_en": "",
    "band": "A",
    "level": 2,
    "topic": "教育",
    "tags": []
  },
  {
    "id": "A2-0134",
    "trad": "選擇",
    "pinyin": "xuănzé",
    "pos": "N / V",
    "gloss_en": "",
    "band": "A",
    "level": 2,
    "topic": "教育",
    "tags": []
  },
  {
    "id": "A2-0135",
    "trad": "建議",
    "pinyin": "jiànyì",
    "pos": "N / V",
    "gloss_en": "",
    "band": "A",
    "level": 2,
    "topic": "教育",
    "tags": []
  },
  {
    "id": "A2-0136",
    "trad": "知識",
    "pinyin": "zhīshì",
    "pos": "N",
    "gloss_en": "",
    "band": "A",
    "level": 2,
    "topic": "教育",
    "tags": []
  },
  {
    "id": "A2-0137",
    "trad": "座",
    "pinyin": "zuò",
    "pos": "M",
    "gloss_en": "",
    "band": "A",
    "level": 2,
    "topic": "房屋與家庭、環境",
    "tags": []
  },
  {
    "id": "A2-0138",
    "trad": "臥室",
    "pinyin": "wòshì",
    "pos": "N",
    "gloss_en": "",
    "band": "A",
    "level": 2,
    "topic": "房屋與家庭、環境",
    "tags": []
  },
  {
    "id": "A2-0139",
    "trad": "臥房",
    "pinyin": "wòfáng",
    "pos": "N",
    "gloss_en": "",
    "band": "A",
    "level": 2,
    "topic": "房屋與家庭、環境",
    "tags": []
  },
  {
    "id": "A2-0140",
    "trad": "浴室",
    "pinyin": "yùshì",
    "pos": "N",
    "gloss_en": "",
    "band": "A",
    "level": 2,
    "topic": "房屋與家庭、環境",
    "tags": []
  },
  {
    "id": "A2-0141",
    "trad": "院(子)",
    "pinyin": "yuàn(zi)",
    "pos": "N",
    "gloss_en": "",
    "band": "A",
    "level": 2,
    "topic": "房屋與家庭、環境",
    "tags": []
  },
  {
    "id": "A2-0142",
    "trad": "書房",
    "pinyin": "shūfáng",
    "pos": "N",
    "gloss_en": "",
    "band": "A",
    "level": 2,
    "topic": "房屋與家庭、環境",
    "tags": []
  },
  {
    "id": "A2-0143",
    "trad": "洗衣機",
    "pinyin": "xĭyījī",
    "pos": "N",
    "gloss_en": "",
    "band": "A",
    "level": 2,
    "topic": "房屋與家庭、環境",
    "tags": []
  },
  {
    "id": "A2-0144",
    "trad": "餐桌",
    "pinyin": "cānzhuō",
    "pos": "N",
    "gloss_en": "",
    "band": "A",
    "level": 2,
    "topic": "房屋與家庭、環境",
    "tags": []
  },
  {
    "id": "A2-0145",
    "trad": "打開",
    "pinyin": "dăkāi",
    "pos": "Vp",
    "gloss_en": "",
    "band": "A",
    "level": 2,
    "topic": "房屋與家庭、環境",
    "tags": []
  },
  {
    "id": "A2-0146",
    "trad": "箱/箱(子)",
    "pinyin": "xiāng /xiāng(zi)",
    "pos": "M / N",
    "gloss_en": "",
    "band": "A",
    "level": 2,
    "topic": "房屋與家庭、環境",
    "tags": []
  },
  {
    "id": "A2-0147",
    "trad": "層",
    "pinyin": "céng",
    "pos": "M",
    "gloss_en": "",
    "band": "A",
    "level": 2,
    "topic": "房屋與家庭、環境",
    "tags": []
  },
  {
    "id": "A2-0148",
    "trad": "櫃(子)",
    "pinyin": "guì(zi)",
    "pos": "N",
    "gloss_en": "",
    "band": "A",
    "level": 2,
    "topic": "房屋與家庭、環境",
    "tags": []
  },
  {
    "id": "A2-0149",
    "trad": "大門",
    "pinyin": "dàmén",
    "pos": "N",
    "gloss_en": "",
    "band": "A",
    "level": 2,
    "topic": "房屋與家庭、環境",
    "tags": []
  },
  {
    "id": "A2-0150",
    "trad": "鄰居",
    "pinyin": "línjū",
    "pos": "N",
    "gloss_en": "",
    "band": "A",
    "level": 2,
    "topic": "房屋與家庭、環境",
    "tags": []
  }
]