[
  {
    "id": "A1-0296",
    "trad": "三明治",
    "pinyin": "sānmíngzhì",
    "pos": "N",
    "gloss_en": "",
    "band": "A",
    "level": 1,
    "topic": "飲食",
    "tags": []
  },
  {
    "id": "A1-0297",
    "trad": "漢堡",
    "pinyin": "hànbăo",
    "pos": "N",
    "gloss_en": "",
    "band": "A",
    "level": 1,
    "topic": "飲食",
    "tags": []
  },
  {
    "id": "A1-0298",
    "trad": "蘋果",
    "pinyin": "píngguŏ",
    "pos": "N",
    "gloss_en": "",
    "band": "A",
    "level": 1,
    "topic": "飲食",
    "tags": []
  },
  {
    "id": "A1-0299",
    "trad": "西瓜",
    "pinyin": "xīguā",
    "pos": "N",
    "gloss_en": "",
    "band": "A",
    "level": 1,
    "topic": "飲食",
    "tags": []
  },
  {
    "id": "A1-0300",
    "trad": "啤酒",
    "pinyin": "píjiŭ",
    "pos": "N",
    "gloss_en": "",
    "band": "A",
    "level": 1,
    "topic": "飲食",
    "tags": []
  },
  {
    "id": "A1-0301",
    "trad": "紅茶",
    "pinyin": "hóngchá",
    "pos": "N",
    "gloss_en": "",
    "band": "A",
    "level": 1,
    "topic": "飲食",
    "tags": []
  },
  {
    "id": "A1-0302",
    "trad": "點心",
    "pinyin": "diănxīn",
    "pos": "N",
    "gloss_en": "",
    "band": "A",
    "level": 1,
    "topic": "飲食",
    "tags": []
  },
  {
    "id": "A1-0303",
    "trad": "冰淇淋",
    "pinyin": "bīngqílín",
    "pos": "N",
    "gloss_en": "",
    "band": "A",
    "level": 1,
    "topic": "飲食",
    "tags": []
  },
  {
    "id": "A1-0304",
    "trad": "青菜",
    "pinyin": "qīngcài",
    "pos": "N",
    "gloss_en": "",
    "band": "A",
    "level": 1,
    "topic": "飲食",
    "tags": []
  },
  {
    "id": "A1-0305",
    "trad": "糖",
    "pinyin": "táng",
    "pos": "N",
    "gloss_en": "",
    "band": "A",
    "level": 1,
    "topic": "飲食",
    "tags": []
  },
  {
    "id": "A1-0306",
    "trad": "叉(子)",
    "pinyin": "chā(zi)",
    "pos": "N",
    "gloss_en": "",
    "band": "A",
    "level": 1,
    "topic": "飲食",
    "tags": []
  },
  {
    "id": "A1-0307",
    "trad": "刀(子)",
    "pinyin": "dāo(zi)",
    "pos": "N",
    "gloss_en": "",
    "band": "A",
    "level": 1,
    "topic": "飲食",
    "tags": []
  },
  {
    "id": "A1-0308",
    "trad": "湯匙",
    "pinyin": "tāngchí",
    "pos": "N",
    "gloss_en": "",
    "band": "A",
    "level": 1,
    "topic": "飲食",
    "tags": []
  },
  {
    "id": "A1-0309",
    "trad": "盤/盤(子)",
    "pinyin": "pán(zi)",
    "pos": "M / N",
    "gloss_en": "",
    "band": "A",
    "level": 1,
    "topic": "飲食",
    "tags": []
  },
  {
    "id": "A1-0310",
    "trad": "片",
    "pinyin": "piàn",
    "pos": "M",
    "gloss_en": "",
    "band": "A",
    "level": 1,
    "topic": "飲食",
    "tags": []
  },
  {
    "id": "A1-0311",
    "trad": "瓶/瓶(子)",
    "pinyin": "píng(zi)",
    "pos": "M / N",
    "gloss_en": "",
    "band": "A",
    "level": 1,
    "topic": "飲食",
    "tags": []
  },
  {
    "id": "A1-0312",
    "trad": "支",
    "pinyin": "zhī",
    "pos": "M",
    "gloss_en": "",
    "band": "A",
    "level": 1,
    "topic": "飲食",
    "tags": []
  },
  {
    "id": "A1-0313",
    "trad": "份",
    "pinyin": "fèn",
    "pos": "M",
    "gloss_en": "",
    "band": "A",
    "level": 1,
    "topic": "飲食",
    "tags": []
  },
  {
    "id": "A1-0314",
    "trad": "道",
    "pinyin": "dào",
    "pos": "M",
    "gloss_en": "",
    "band": "A",
    "level": 1,
    "topic": "飲食",
    "tags": []
  },
  {
    "id": "A1-0315",
    "trad": "一半/一半兒",
    "pinyin": "yībàn/yībànr",
    "pos": "Det",
    "gloss_en": "",
    "band": "A",
    "level": 1,
    "topic": "飲食",
    "tags": []
  },
  {
    "id": "A1-0316",
    "trad": "味道",
    "pinyin": "wèidào",
    "pos": "N",
    "gloss_en": "",
    "band": "A",
    "level": 1,
    "topic": "飲食",
    "tags": []
  },
  {
    "id": "A1-0317",
    "trad": "酸",
    "pinyin": "suān",
    "pos": "Vs",
    "gloss_en": "",
    "band": "A",
    "level": 1,
    "topic": "飲食",
    "tags": []
  },
  {
    "id": "A1-0318",
    "trad": "苦",
    "pinyin": "kŭ",
    "pos": "Vs",
    "gloss_en": "",
    "band": "A",
    "level": 1,
    "topic": "飲食",
    "tags": []
  },
  {
    "id": "A1-0319",
    "trad": "鹹",
    "pinyin": "xián",
    "pos": "Vs",
    "gloss_en": "",
    "band": "A",
    "level": 1,
    "topic": "飲食",
    "tags": []
  },
  {
    "id": "A1-0320",
    "trad": "辣",
    "pinyin": "là",
    "pos": "Vs",
    "gloss_en": "",
    "band": "A",
    "level": 1,
    "topic": "飲食",
    "tags": []
  },
  {
    "id": "A1-0321",
    "trad": "香",
    "pinyin": "xiāng",
    "pos": "Vs",
    "gloss_en": "",
    "band": "A",
    "level": 1,
    "topic": "飲食",
    "tags": []
  },
  {
    "id": "A1-0322",
    "trad": "條",
    "pinyin": "tiáo",
    "pos": "M",
    "gloss_en": "",
    "band": "A",
    "level": 1,
    "topic": "飲食",
    "tags": []
  },
  {
    "id": "A1-0323",
    "trad": "種",
    "pinyin": "zhŏng",
    "pos": "M",
    "gloss_en": "",
    "band": "A",
    "level": 1,
    "topic": "飲食",
    "tags": []
  },
  {
    "id": "A1-0324",
    "trad": "包",
    "pinyin": "bāo",
    "pos": "M",
    "gloss_en": "",
    "band": "A",
    "level": 1,
    "topic": "飲食",
    "tags": []
  },
  {
    "id": "A1-0325",
    "trad": "全部",
    "pinyin": "quánbù",
    "pos": "Det",
    "gloss_en": "",
    "band": "A",
    "level": 1,
    "topic": "飲食",
    "tags": []
  },
  {
    "id": "A1-0326",
    "trad": "所有",
    "pinyin": "suŏyŏu",
    "pos": "Det",
    "gloss_en": "",
    "band": "A",
    "level": 1,
    "topic": "飲食",
    "tags": []
  },
  {
    "id": "A1-0327",
    "trad": "需要",
    "pinyin": "xūyào",
    "pos": "Vst",
    "gloss_en": "",
    "band": "A",
    "level": 1,
    "topic": "飲食",
    "tags": []
  },
  {
    "id": "A1-0328",
    "trad": "烤",
    "pinyin": "kăo",
    "pos": "V",
    "gloss_en": "",
    "band": "A",
    "level": 1,
    "topic": "飲食",
    "tags": []
  }
]