[
  {
    "id": "A2-0201",
    "trad": "完",
    "pinyin": "wán",
    "pos": "Vp",
    "gloss_en": "",
    "band": "A",
    "level": 2,
    "topic": "閒暇時間、娛樂",
    "tags": []
  },
  {
    "id": "A2-0202",
    "trad": "散步",
    "pinyin": "sànbù",
    "pos": "V-sep",
    "gloss_en": "",
    "band": "A",
    "level": 2,
    "topic": "閒暇時間、娛樂",
    "tags": []
  },
  {
    "id": "A2-0203",
    "trad": "慢跑",
    "pinyin": "mànpăo",
    "pos": "Vi",
    "gloss_en": "",
    "band": "A",
    "level": 2,
    "topic": "閒暇時間、娛樂",
    "tags": []
  },
  {
    "id": "A2-0204",
    "trad": "野餐",
    "pinyin": "yěcān",
    "pos": "Vi",
    "gloss_en": "",
    "band": "A",
    "level": 2,
    "topic": "閒暇時間、娛樂",
    "tags": []
  },
  {
    "id": "A2-0205",
    "trad": "爬",
    "pinyin": "pá",
    "pos": "Vi",
    "gloss_en": "",
    "band": "A",
    "level": 2,
    "topic": "閒暇時間、娛樂",
    "tags": []
  },
  {
    "id": "A2-0206",
    "trad": "拍",
    "pinyin": "pāi",
    "pos": "V",
    "gloss_en": "",
    "band": "A",
    "level": 2,
    "topic": "閒暇時間、娛樂",
    "tags": []
  },
  {
    "id": "A2-0207",
    "trad": "抓",
    "pinyin": "zhuā",
    "pos": "V",
    "gloss_en": "",
    "band": "A",
    "level": 2,
    "topic": "閒暇時間、娛樂",
    "tags": []
  },
  {
    "id": "A2-0208",
    "trad": "座位",
    "pinyin": "zuòwèi",
    "pos": "N",
    "gloss_en": "",
    "band": "A",
    "level": 2,
    "topic": "閒暇時間、娛樂",
    "tags": []
  },
  {
    "id": "A2-0209",
    "trad": "新聞",
    "pinyin": "xīnwén",
    "pos": "N",
    "gloss_en": "",
    "band": "A",
    "level": 2,
    "topic": "閒暇時間、娛樂",
    "tags": []
  },
  {
    "id": "A2-0210",
    "trad": "體育",
    "pinyin": "tĭyù",
    "pos": "N",
    "gloss_en": "",
    "band": "A",
    "level": 2,
    "topic": "閒暇時間、娛樂",
    "tags": []
  },
  {
    "id": "A2-0211",
    "trad": "經常",
    "pinyin": "jīngcháng",
    "pos": "Adv",
    "gloss_en": "",
    "band": "A",
    "level": 2,
    "topic": "閒暇時間、娛樂",
    "tags": []
  },
  {
    "id": "A2-0212",
    "trad": "雜誌",
    "pinyin": "zázhì",
    "pos": "N",
    "gloss_en": "",
    "band": "A",
    "level": 2,
    "topic": "閒暇時間、娛樂",
    "tags": []
  },
  {
    "id": "A2-0213",
    "trad": "美術",
    "pinyin": "měishù",
    "pos": "N",
    "gloss_en": "",
    "band": "A",
    "level": 2,
    "topic": "閒暇時間、娛樂",
    "tags": []
  },
  {
    "id": "A2-0214",
    "trad": "畫家",
    "pinyin": "huàjiā",
    "pos": "N",
    "gloss_en": "",
    "band": "A",
    "level": 2,
    "topic": "閒暇時間、娛樂",
    "tags": []
  },
  {
    "id": "A2-0215",
    "trad": "興趣",
    "pinyin": "xìngqù",
    "pos": "N",
    "gloss_en": "",
    "band": "A",
    "level": 2,
    "topic": "閒暇時間、娛樂",
    "tags": []
  },
  {
    "id": "A2-0216",
    "trad": "收",
    "pinyin": "shōu",
    "pos": "V",
    "gloss_en": "",
    "band": "A",
    "level": 2,
    "topic": "閒暇時間、娛樂",
    "tags": []
  },
  {
    "id": "A2-0217",
    "trad": "談",
    "pinyin": "tán",
    "pos": "V",
    "gloss_en": "",
    "band": "A",
    "level": 2,
    "topic": "閒暇時間、娛樂",
    "tags": []
  },
  {
    "id": "A2-0218",
    "trad": "聊",
    "pinyin": "liáo",
    "pos": "V",
    "gloss_en": "",
    "band": "A",
    "level": 2,
    "topic": "閒暇時間、娛樂",
    "tags": []
  },
  {
    "id": "A2-0219",
    "trad": "遲到",
    "pinyin": "chídào",
    "pos": "Vp",
    "gloss_en": "",
    "band": "A",
    "level": 2,
    "topic": "閒暇時間、娛樂",
    "tags": []
  },
  {
    "id": "A2-0220",
    "trad": "樂器",
    "pinyin": "yuèqì",
    "pos": "N",
    "gloss_en": "",
    "band": "A",
    "level": 2,
    "topic": "閒暇時間、娛樂",
    "tags": []
  },
  {
    "id": "A2-0221",
    "trad": "吉他",
    "pinyin": "jítā",
    "pos": "N",
    "gloss_en": "",
    "band": "A",
    "level": 2,
    "topic": "閒暇時間、娛樂",
    "tags": []
  },
  {
    "id": "A2-0222",
    "trad": "可怕",
    "pinyin": "kěpà",
    "pos": "Vs",
    "gloss_en": "",
    "band": "A",
    "level": 2,
    "topic": "閒暇時間、娛樂",
    "tags": []
  },
  {
    "id": "A2-0223",
    "trad": "輕鬆",
    "pinyin": "qīngsōng",
    "pos": "Vs",
    "gloss_en": "",
    "band": "A",
    "level": 2,
    "topic": "閒暇時間、娛樂",
    "tags": []
  },
  {
    "id": "A2-0224",
    "trad": "情形",
    "pinyin": "qíngxíng",
    "pos": "N",
    "gloss_en": "",
    "band": "A",
    "level": 2,
    "topic": "閒暇時間、娛樂",
    "tags": []
  },
  {
    "id": "A2-0225",
    "trad": "消息",
    "pinyin": "xiāoxí",
    "pos": "N",
    "gloss_en": "",
    "band": "A",
    "level": 2,
    "topic": "閒暇時間、娛樂",
    "tags": []
  },
  {
    "id": "A2-0226",
    "trad": "看起來",
    "pinyin": "kànqĭlái",
    "pos": "Adv",
    "gloss_en": "",
    "band": "A",
    "level": 2,
    "topic": "閒暇時間、娛樂",
    "tags": []
  },
  {
    "id": "A2-0227",
    "trad": "舞",
    "pinyin": "wŭ",
    "pos": "N",
    "gloss_en": "",
    "band": "A",
    "level": 2,
    "topic": "閒暇時間、娛樂",
    "tags": []
  },
  {
    "id": "A2-0228",
    "trad": "游",
    "pinyin": "yóu",
    "pos": "Vi",
    "gloss_en": "",
    "band": "A",
    "level": 2,
    "topic": "閒暇時間、娛樂",
    "tags": []
  },
  {
    "id": "A2-0229",
    "trad": "游泳池",
    "pinyin": "yóuyŏngchí",
    "pos": "N",
    "gloss_en": "",
    "band": "A",
    "level": 2,
    "topic": "閒暇時間、娛樂",
    "tags": []
  },
  {
    "id": "A2-0230",
    "trad": "遊戲",
    "pinyin": "yóuxì",
    "pos": "N / Vi",
    "gloss_en": "",
    "band": "A",
    "level": 2,
    "topic": "閒暇時間、娛樂",
    "tags": []
  },
  {
    "id": "A2-0231",
    "trad": "茶館/茶館兒",
    "pinyin": "cháguăn/cháguănr",
    "pos": "N",
    "gloss_en": "",
    "band": "A",
    "level": 2,
    "topic": "閒暇時間、娛樂",
    "tags": []
  },
  {
    "id": "A2-0232",
    "trad": "門票",
    "pinyin": "ménpiào",
    "pos": "N",
    "gloss_en": "",
    "band": "A",
    "level": 2,
    "topic": "閒暇時間、娛樂",
    "tags": []
  },
  {
    "id": "A2-0233",
    "trad": "陪",
    "pinyin": "péi",
    "pos": "V",
    "gloss_en": "",
    "band": "A",
    "level": 2,
    "topic": "與他人的關係",
    "tags": []
  },
  {
    "id": "A2-0234",
    "trad": "利用",
    "pinyin": "lìyòng",
    "pos": "V",
    "gloss_en": "",
    "band": "A",
    "level": 2,
    "topic": "與他人的關係",
    "tags": []
  },
  {
    "id": "A2-0235",
    "trad": "好處",
    "pinyin": "hăochù",
    "pos": "N",
    "gloss_en": "",
    "band": "A",
    "level": 2,
    "topic": "與他人的關係",
    "tags": []
  },
  {
    "id": "A2-0236",
    "trad": "壞處",
    "pinyin": "huàichù",
    "pos": "N",
    "gloss_en": "",
    "band": "A",
    "level": 2,
    "topic": "與他人的關係",
    "tags": []
  },
  {
    "id": "A2-0237",
    "trad": "目的",
    "pinyin": "mùdì",
    "pos": "N",
    "gloss_en": "",
    "band": "A",
    "level": 2,
    "topic": "與他人的關係",
    "tags": []
  },
  {
    "id": "A2-0238",
    "trad": "要求",
    "pinyin": "yāoqiú",
    "pos": "N / V",
    "gloss_en": "",
    "band": "A",
    "level": 2,
    "topic": "與他人的關係",
    "tags": []
  },
  {
    "id": "A2-0239",
    "trad": "合作",
    "pinyin": "hézuò",
    "pos": "Vs",
    "gloss_en": "",
    "band": "A",
    "level": 2,
    "topic": "與他人的關係",
    "tags": []
  },
  {
    "id": "A2-0240",
    "trad": "主人",
    "pinyin": "zhǔrén",
    "pos": "N",
    "gloss_en": "",
    "band": "A",
    "level": 2,
    "topic": "與他人的關係",
    "tags": []
  },
  {
    "id": "A2-0241",
    "trad": "請客",
    "pinyin": "qĭngkè",
    "pos": "V-sep",
    "gloss_en": "",
    "band": "A",
    "level": 2,
    "topic": "與他人的關係",
    "tags": []
  },
  {
    "id": "A2-0242",
    "trad": "約",
    "pinyin": "yuē",
    "pos": "V",
    "gloss_en": "",
    "band": "A",
    "level": 2,
    "topic": "與他人的關係",
    "tags": []
  },
  {
    "id": "A2-0243",
    "trad": "約會",
    "pinyin": "yuēhuì",
    "pos": "N / Vi",
    "gloss_en": "",
    "band": "A",
    "level": 2,
    "topic": "與他人的關係",
    "tags": []
  },
  {
    "id": "A2-0244",
    "trad": "派對",
    "pinyin": "pàiduì",
    "pos": "N",
    "gloss_en": "",
    "band": "A",
    "level": 2,
    "topic": "與他人的關係",
    "tags": []
  },
  {
    "id": "A2-0245",
    "trad": "祝",
    "pinyin": "zhù",
    "pos": "V",
    "gloss_en": "",
    "band": "A",
    "level": 2,
    "topic": "與他人的關係",
    "tags": []
  },
  {
    "id": "A2-0246",
    "trad": "留",
    "pinyin": "liú",
    "pos": "V",
    "gloss_en": "",
    "band": "A",
    "level": 2,
    "topic": "與他人的關係",
    "tags": []
  },
  {
    "id": "A2-0247",
    "trad": "封",
    "pinyin": "fēng",
    "pos": "M",
    "gloss_en": "",
    "band": "A",
    "level": 2,
    "topic": "與他人的關係",
    "tags": []
  },
  {
    "id": "A2-0248",
    "trad": "信箱",
    "pinyin": "xìnxiāng",
    "pos": "N",
    "gloss_en": "",
    "band": "A",
    "level": 2,
    "topic": "與他人的關係",
    "tags": []
  },
  {
    "id": "A2-0249",
    "trad": "郵票",
    "pinyin": "yóupiào",
    "pos": "N",
    "gloss_en": "",
    "band": "A",
    "level": 2,
    "topic": "與他人的關係",
    "tags": []
  },
  {
    "id": "A2-0250",
    "trad": "回信",
    "pinyin": "huíxìn",
    "pos": "V-sep",
    "gloss_en": "",
    "band": "A",
    "level": 2,
    "topic": "與他人的關係",
    "tags": []
  }
]