[
  {
    "id": "A1-0153",
    "trad": "過年",
    "pinyin": "guònián",
    "pos": "Vi",
    "gloss_en": "",
    "band": "A",
    "level": 1,
    "topic": "閒暇時間、娛樂",
    "tags": []
  },
  {
    "id": "A1-0154",
    "trad": "新年",
    "pinyin": "xīnnián",
    "pos": "N",
    "gloss_en": "",
    "band": "A",
    "level": 1,
    "topic": "閒暇時間、娛樂",
    "tags": []
  },
  {
    "id": "A1-0155",
    "trad": "游泳",
    "pinyin": "yóuyŏng",
    "pos": "V-sep",
    "gloss_en": "",
    "band": "A",
    "level": 1,
    "topic": "閒暇時間、娛樂",
    "tags": []
  },
  {
    "id": "A1-0156",
    "trad": "跑/跑步",
    "pinyin": "păo/păobù",
    "pos": "Vi",
    "gloss_en": "",
    "band": "A",
    "level": 1,
    "topic": "閒暇時間、娛樂",
    "tags": []
  },
  {
    "id": "A1-0157",
    "trad": "踢",
    "pinyin": "tī",
    "pos": "V",
    "gloss_en": "",
    "band": "A",
    "level": 1,
    "topic": "閒暇時間、娛樂",
    "tags": []
  },
  {
    "id": "A1-0158",
    "trad": "足球",
    "pinyin": "zúqiú",
    "pos": "N",
    "gloss_en": "",
    "band": "A",
    "level": 1,
    "topic": "閒暇時間、娛樂",
    "tags": []
  },
  {
    "id": "A1-0159",
    "trad": "籃球",
    "pinyin": "lánqiú",
    "pos": "N",
    "gloss_en": "",
    "band": "A",
    "level": 1,
    "topic": "閒暇時間、娛樂",
    "tags": []
  },
  {
    "id": "A1-0160",
    "trad": "網球",
    "pinyin": "wăngqiú",
    "pos": "N",
    "gloss_en": "",
    "band": "A",
    "level": 1,
    "topic": "閒暇時間、娛樂",
    "tags": []
  },
  {
    "id": "A1-0161",
    "trad": "棒球",
    "pinyin": "bàngqiú",
    "pos": "N",
    "gloss_en": "",
    "band": "A",
    "level": 1,
    "topic": "閒暇時間、娛樂",
    "tags": []
  },
  {
    "id": "A1-0162",
    "trad": "比賽",
    "pinyin": "bĭsài",
    "pos": "Vi / N",
    "gloss_en": "",
    "band": "A",
    "level": 1,
    "topic": "閒暇時間、娛樂",
    "tags": []
  },
  {
    "id": "A1-0163",
    "trad": "開始",
    "pinyin": "kāishĭ",
    "pos": "Vp",
    "gloss_en": "",
    "band": "A",
    "level": 1,
    "topic": "閒暇時間、娛樂",
    "tags": []
  },
  {
    "id": "A1-0164",
    "trad": "騎",
    "pinyin": "qí",
    "pos": "V",
    "gloss_en": "",
    "band": "A",
    "level": 1,
    "topic": "閒暇時間、娛樂",
    "tags": []
  },
  {
    "id": "A1-0165",
    "trad": "腳踏車/自行車",
    "pinyin": "jiăotàchē/zìxíngchē",
    "pos": "N",
    "gloss_en": "",
    "band": "A",
    "level": 1,
    "topic": "閒暇時間、娛樂",
    "tags": []
  },
  {
    "id": "A1-0166",
    "trad": "上網",
    "pinyin": "shàngwăng",
    "pos": "V-sep",
    "gloss_en": "",
    "band": "A",
    "level": 1,
    "topic": "閒暇時間、娛樂",
    "tags": []
  },
  {
    "id": "A1-0167",
    "trad": "網路",
    "pinyin": "wănglù",
    "pos": "N",
    "gloss_en": "",
    "band": "A",
    "level": 1,
    "topic": "閒暇時間、娛樂",
    "tags": []
  },
  {
    "id": "A1-0168",
    "trad": "網站",
    "pinyin": "wăngzhàn",
    "pos": "N",
    "gloss_en": "",
    "band": "A",
    "level": 1,
    "topic": "閒暇時間、娛樂",
    "tags": []
  },
  {
    "id": "A1-0169",
    "trad": "報紙",
    "pinyin": "bàozhĭ",
    "pos": "N",
    "gloss_en": "",
    "band": "A",
    "level": 1,
    "topic": "閒暇時間、娛樂",
    "tags": []
  },
  {
    "id": "A1-0170",
    "trad": "次",
    "pinyin": "cì",
    "pos": "M",
    "gloss_en": "",
    "band": "A",
    "level": 1,
    "topic": "閒暇時間、娛樂",
    "tags": []
  },
  {
    "id": "A1-0171",
    "trad": "電影院",
    "pinyin": "diànyĭngyuàn",
    "pos": "N",
    "gloss_en": "",
    "band": "A",
    "level": 1,
    "topic": "閒暇時間、娛樂",
    "tags": []
  },
  {
    "id": "A1-0172",
    "trad": "部",
    "pinyin": "bù",
    "pos": "M",
    "gloss_en": "",
    "band": "A",
    "level": 1,
    "topic": "閒暇時間、娛樂",
    "tags": []
  },
  {
    "id": "A1-0173",
    "trad": "場",
    "pinyin": "chăng",
    "pos": "M",
    "gloss_en": "",
    "band": "A",
    "level": 1,
    "topic": "閒暇時間、娛樂",
    "tags": []
  },
  {
    "id": "A1-0174",
    "trad": "音樂",
    "pinyin": "yīnyuè",
    "pos": "N",
    "gloss_en": "",
    "band": "A",
    "level": 1,
    "topic": "閒暇時間、娛樂",
    "tags": []
  },
  {
    "id": "A1-0175",
    "trad": "票",
    "pinyin": "piào",
    "pos": "N",
    "gloss_en": "",
    "band": "A",
    "level": 1,
    "topic": "閒暇時間、娛樂",
    "tags": []
  },
  {
    "id": "A1-0176",
    "trad": "活動",
    "pinyin": "huódòng",
    "pos": "N",
    "gloss_en": "",
    "band": "A",
    "level": 1,
    "topic": "閒暇時間、娛樂",
    "tags": []
  },
  {
    "id": "A1-0177",
    "trad": "故事(˙ㄕ)",
    "pinyin": "gùshi",
    "pos": "N",
    "gloss_en": "",
    "band": "A",
    "level": 1,
    "topic": "閒暇時間、娛樂",
    "tags": []
  },
  {
    "id": "A1-0178",
    "trad": "聊天/聊天兒",
    "pinyin": "liáotiān/liáotiānr",
    "pos": "V-sep",
    "gloss_en": "",
    "band": "A",
    "level": 1,
    "topic": "閒暇時間、娛樂",
    "tags": []
  },
  {
    "id": "A1-0179",
    "trad": "有時候(˙ㄏㄡ)/有時",
    "pinyin": "yŏushíhou/yŏushí",
    "pos": "Adv",
    "gloss_en": "",
    "band": "A",
    "level": 1,
    "topic": "閒暇時間、娛樂",
    "tags": []
  },
  {
    "id": "A1-0180",
    "trad": "平常",
    "pinyin": "píngcháng",
    "pos": "N",
    "gloss_en": "",
    "band": "A",
    "level": 1,
    "topic": "閒暇時間、娛樂",
    "tags": []
  },
  {
    "id": "A1-0181",
    "trad": "總是",
    "pinyin": "zŏngshì",
    "pos": "Adv",
    "gloss_en": "",
    "band": "A",
    "level": 1,
    "topic": "閒暇時間、娛樂",
    "tags": []
  },
  {
    "id": "A1-0182",
    "trad": "已經",
    "pinyin": "yĭjīng",
    "pos": "Adv",
    "gloss_en": "",
    "band": "A",
    "level": 1,
    "topic": "閒暇時間、娛樂",
    "tags": []
  },
  {
    "id": "A1-0183",
    "trad": "後來",
    "pinyin": "hòulái",
    "pos": "N",
    "gloss_en": "",
    "band": "A",
    "level": 1,
    "topic": "閒暇時間、娛樂",
    "tags": []
  },
  {
    "id": "A1-0184",
    "trad": "各",
    "pinyin": "gè",
    "pos": "Det",
    "gloss_en": "",
    "band": "A",
    "level": 1,
    "topic": "閒暇時間、娛樂",
    "tags": []
  },
  {
    "id": "A1-0185",
    "trad": "變",
    "pinyin": "biàn",
    "pos": "V",
    "gloss_en": "",
    "band": "A",
    "level": 1,
    "topic": "閒暇時間、娛樂",
    "tags": []
  },
  {
    "id": "A1-0186",
    "trad": "才",
    "pinyin": "cái",
    "pos": "Adv",
    "gloss_en": "",
    "band": "A",
    "level": 1,
    "topic": "閒暇時間、娛樂",
    "tags": []
  }
]